[
  {
    "check_id": "CHK_PH_001_CURRENT_DATE_NULL_CHECK",
    "category": "Null Check",
    "sql_query": "SELECT COUNT(*) as cnt FROM `project.dataset.employees` WHERE hire_date = {currently} AND employee_id IS NULL",
    "description": "Verify no NULL employee IDs for employees hired on run date",
    "severity": "High",
    "expected_output": "0",
    "comparison_type": "numeric_condition",
    "impacted_downstream": ["HR_Dashboard", "Payroll_System"],
    "tags": ["employee", "critical", "daily", "placeholder"],
    "active": true
  },
  {
    "check_id": "CHK_PH_002_PARTITION_SALES_COUNT",
    "category": "Threshold Check",
    "sql_query": "SELECT COUNT(*) as cnt FROM `project.dataset.sales` WHERE partition_dt = {partition_info}",
    "description": "Verify sales records exist in latest partition",
    "severity": "High",
    "expected_output": ">0",
    "comparison_type": "numeric_condition",
    "impacted_downstream": ["Sales_Dashboard", "Revenue_Report"],
    "tags": ["sales", "partition", "critical", "placeholder"],
    "active": true
  },
  {
    "check_id": "CHK_PH_003_BOTH_PLACEHOLDERS",
    "category": "Threshold Check",
    "sql_query": "SELECT COUNT(*) as cnt FROM `project.dataset.orders` WHERE order_date = {currently} AND partition_dt = {partition_info}",
    "description": "Count orders for run date in latest partition",
    "severity": "Medium",
    "expected_output": ">=10",
    "comparison_type": "numeric_condition",
    "impacted_downstream": ["Order_Dashboard"],
    "tags": ["orders", "daily", "placeholder"],
    "active": true
  },
  {
    "check_id": "CHK_PH_004_CURRENT_DATE_RANGE",
    "category": "Threshold Check",
    "sql_query": "SELECT COUNT(DISTINCT department) as dept_count FROM `project.dataset.employees` WHERE hire_date <= {currently}",
    "description": "Verify at least 10 departments have employees hired by run date",
    "severity": "Medium",
    "expected_output": ">=10",
    "comparison_type": "numeric_condition",
    "impacted_downstream": ["Department_Report", "HR_Dashboard"],
    "tags": ["employee", "department", "placeholder"],
    "active": true
  },
  {
    "check_id": "CHK_PH_005_PARTITION_NULL_CHECK",
    "category": "Null Check",
    "sql_query": "SELECT COUNT(*) as cnt FROM `project.dataset.sales` WHERE partition_dt = {partition_info} AND amount IS NULL",
    "description": "Verify no NULL amounts in latest sales partition",
    "severity": "High",
    "expected_output": "0",
    "comparison_type": "numeric_condition",
    "impacted_downstream": ["Sales_Dashboard", "Finance_Report"],
    "tags": ["sales", "partition", "critical", "placeholder"],
    "active": true
  },
  {
    "check_id": "CHK_PH_006_CURRENT_DATE_STATUS_CHECK",
    "category": "Value Check",
    "sql_query": "SELECT DISTINCT status FROM `project.dataset.orders` WHERE order_date = {currently}",
    "description": "Verify only valid statuses for orders on run date",
    "severity": "Medium",
    "expected_output": ["Pending", "Completed", "Shipped"],
    "comparison_type": "set_match",
    "impacted_downstream": ["Order_Dashboard"],
    "tags": ["orders", "status", "placeholder"],
    "active": true
  },
  {
    "check_id": "CHK_PH_007_PARTITION_REGION_CHECK",
    "category": "Value Check",
    "sql_query": "SELECT DISTINCT region FROM `project.dataset.sales` WHERE partition_dt = {partition_info}",
    "description": "Verify only valid regions in latest sales partition",
    "severity": "Medium",
    "expected_output": ["APAC", "Americas", "EMEA"],
    "comparison_type": "set_match",
    "impacted_downstream": ["Regional_Sales_Report"],
    "tags": ["sales", "region", "partition", "placeholder"],
    "active": true
  },
  {
    "check_id": "CHK_PH_008_NO_INVALID_STATUS_CURRENT",
    "category": "Value Check",
    "sql_query": "SELECT DISTINCT status FROM `project.dataset.orders` WHERE order_date = {currently}",
    "description": "Verify no INVALID or ERROR status for orders on run date",
    "severity": "High",
    "expected_output": ["INVALID", "ERROR"],
    "comparison_type": "not_in_result",
    "impacted_downstream": ["Order_Dashboard", "Quality_Report"],
    "tags": ["orders", "status", "critical", "placeholder"],
    "active": true
  },
  {
    "check_id": "CHK_PH_009_PARTITION_PRODUCT_CATEGORIES",
    "category": "Value Check",
    "sql_query": "SELECT DISTINCT category FROM `project.dataset.products` WHERE partition_dt = {partition_info}",
    "description": "Verify only Electronics and Furniture categories in latest partition",
    "severity": "Low",
    "expected_output": ["Electronics", "Furniture"],
    "comparison_type": "set_match",
    "impacted_downstream": ["Product_Catalog"],
    "tags": ["product", "category", "partition", "placeholder"],
    "active": true
  },
  {
    "check_id": "CHK_PH_010_CURRENT_AVG_ORDER_AMOUNT",
    "category": "Threshold Check",
    "sql_query": "SELECT AVG(amount) as avg_amount FROM `project.dataset.orders` WHERE order_date = {currently}",
    "description": "Verify average order amount for run date is above 1000",
    "severity": "Medium",
    "expected_output": ">1000",
    "comparison_type": "numeric_condition",
    "impacted_downstream": ["Sales_Analytics"],
    "tags": ["orders", "amount", "average", "placeholder"],
    "active": true
  },
  {
    "check_id": "CHK_STATIC_001_TOTAL_EMPLOYEES",
    "category": "Threshold Check",
    "sql_query": "SELECT COUNT(*) as emp_count FROM `project.dataset.employees`",
    "description": "Verify total employee count (no placeholders - static check)",
    "severity": "Low",
    "expected_output": ">=10",
    "comparison_type": "numeric_condition",
    "impacted_downstream": ["HR_Dashboard"],
    "tags": ["employee", "count", "static"],
    "active": true
  },
  {
    "check_id": "CHK_STATIC_002_PRODUCT_COUNT",
    "category": "Threshold Check",
    "sql_query": "SELECT COUNT(*) as product_count FROM `project.dataset.products`",
    "description": "Verify total product count (no placeholders - static check)",
    "severity": "Low",
    "expected_output": ">0",
    "comparison_type": "numeric_condition",
    "impacted_downstream": ["Product_Catalog"],
    "tags": ["product", "count", "static"],
    "active": true
  }
]
